title,text,subreddit,date,url,combined_text,sentiment
Poland Belarus border crisis,"The Belarus Polish border crisis was planned in advance to this attack on Ukraine. To test division in the EU and check Polands border defenses. If Poland accepted a bunch of economic migrants from far away they would be weakened for the wave of true refugees coming from Ukraine right now. Putin is a psychopath and has manufactured this attack on Ukraine years in advance. Who knows what else he has planned to do.

Belarus might have even identified areas of weakness around the border in a reconnaissance mission under the guise of helping migrants.

Notice how it always happens in Winter because EU states are more scared to speak up as they are blackmailed by Russian gas. Looking at you Germany

Ukrainians are putting up an excellent fight but Putin eyes will be firmly set on the Baltics and Poland. Godspeed to everyone holding up the Eastern flank of Europe.",poland,2022-02-26 07:32:12,https://www.reddit.com/r/poland/comments/t1racm/poland_belarus_border_crisis/,"Poland Belarus border crisis The Belarus Polish border crisis was planned in advance to this attack on Ukraine. To test division in the EU and check Polands border defenses. If Poland accepted a bunch of economic migrants from far away they would be weakened for the wave of true refugees coming from Ukraine right now. Putin is a psychopath and has manufactured this attack on Ukraine years in advance. Who knows what else he has planned to do.

Belarus might have even identified areas of weakness around the border in a reconnaissance mission under the guise of helping migrants.

Notice how it always happens in Winter because EU states are more scared to speak up as they are blackmailed by Russian gas. Looking at you Germany

Ukrainians are putting up an excellent fight but Putin eyes will be firmly set on the Baltics and Poland. Godspeed to everyone holding up the Eastern flank of Europe.",positive
I was there and saw on my own eyes migration crisis on Polish-Belarusian border. [story in comment],,poland,2022-07-14 12:38:36,https://www.reddit.com/gallery/vyuwl3,I was there and saw on my own eyes migration crisis on Polish-Belarusian border. [story in comment] ,positive
Is anyone else worried about how effective this anti Poland and Ukraine propaganda is online?,"Every mention of refugees in western media is met with ""but Poland is racist and isn't letting black people or Muslims or Indians"". We have let in by far the most people from the conflict and we clearly have no problem doing so. This pro invasion propaganda that's spread to divide us is very effective. People don't realise our biggest refugee group before the Ukranian crisis was Chechens, we don't discriminate. I don't doubt that there's individual cases of discrimination (which sadly exist in every country, at peace or at war), and I also don't doubt there were complications with people who aren't Ukranian nationals. But why is the focus on these small isolated incidents? We have let in half a million people escaping the invasion so far, and at least 1 million Ukranians since the actual conflict started before the invasion. 

I don't know if it's paid propaganda but they genuinely have people believing there's tens of thousands of people of colour stuck on our border not being let in because they aren't white, do these people have sense?",poland,2022-03-03 17:43:51,https://www.reddit.com/r/poland/comments/t5x5sk/is_anyone_else_worried_about_how_effective_this/,"Is anyone else worried about how effective this anti Poland and Ukraine propaganda is online? Every mention of refugees in western media is met with ""but Poland is racist and isn't letting black people or Muslims or Indians"". We have let in by far the most people from the conflict and we clearly have no problem doing so. This pro invasion propaganda that's spread to divide us is very effective. People don't realise our biggest refugee group before the Ukranian crisis was Chechens, we don't discriminate. I don't doubt that there's individual cases of discrimination (which sadly exist in every country, at peace or at war), and I also don't doubt there were complications with people who aren't Ukranian nationals. But why is the focus on these small isolated incidents? We have let in half a million people escaping the invasion so far, and at least 1 million Ukranians since the actual conflict started before the invasion. 

I don't know if it's paid propaganda but they genuinely have people believing there's tens of thousands of people of colour stuck on our border not being let in because they aren't white, do these people have sense?",positive
💀💀💀,,poland,2022-04-04 08:13:32,https://i.redd.it/gbd82hoj0hr81.png,💀💀💀 ,neutral
Border Checks Between Berlin and Warsaw?,With the recent fake visa crisis in Poland does anyone know or have experience with Germany authorities checking documents on trains from Warsaw to Berlin?,poland,2023-11-21 09:44:16,https://www.reddit.com/r/poland/comments/180ddma/border_checks_between_berlin_and_warsaw/,Border Checks Between Berlin and Warsaw? With the recent fake visa crisis in Poland does anyone know or have experience with Germany authorities checking documents on trains from Warsaw to Berlin?,negative
I'm English and proud of poland.,"So I just heard the representative of Poland speak in the UN general assembly.

The heartfelt and caring support towards not just to Ukranian refugees but also towards the many other world-wide nationals crossing the border into Poland is humanely beautiful. Allowing foreign students to take shelter and even carry on their studies within Poland is something I didn't even consider in this crisis, and I was brought to tears hearing the Polish representative. The general public opening their homes and offering their food to refugees is something I dearly hope is true. 

Slava Ukraini and dziękuję piękna polsko.",poland,2022-02-28 17:11:58,https://www.reddit.com/r/poland/comments/t3kgyo/im_english_and_proud_of_poland/,"I'm English and proud of poland. So I just heard the representative of Poland speak in the UN general assembly.

The heartfelt and caring support towards not just to Ukranian refugees but also towards the many other world-wide nationals crossing the border into Poland is humanely beautiful. Allowing foreign students to take shelter and even carry on their studies within Poland is something I didn't even consider in this crisis, and I was brought to tears hearing the Polish representative. The general public opening their homes and offering their food to refugees is something I dearly hope is true. 

Slava Ukraini and dziękuję piękna polsko.",positive
